{"activation_policy":"DENY","bundle_id":"public-quarantine-metadata-2026.09","default_model_visibility":false,"export_schema_version":"proto-agent.public-materials-export.v1","files":{"LICENSES.md":"63cd2f93d3110efc704834f213c74cfe6ca3ce44caacf2713d2ca33b672e0d4c","licenses/catalog.json":"ed7ed39b10da5f0c7e480b3c7544ee1fb81eb507caf5e25f061618c81c919cc5","manifest.json":"6ff0639244a11ac9ae1775bdb255c87e0d177bef5ba96c6dde5929c5e2a046d5","provenance.json":"e8a3aa0b5bd4902011099322812de350659d997a09c5d2cf5dac0a4e91b58553","quarantine.sqlite":"76242cc4b082533d71198e3d0826b8477bbb7929dc3376d446a92e9d39cec84c","records.jsonl":"2a11210d1fb355e6b28f93fe71c9445bf308fa07ea779f19a22f4b578bae8343"},"license_counts":{"CC-BY-4.0":1765,"CC0-1.0":30},"profile":"PUBLIC_QUARANTINE","record_count":1795,"schema_version":"proto-agent.materials-bundle.v1","source_counts":{"BioModels":30,"Rhea":21,"UniProtKB/Swiss-Prot":1744},"status_counts":{"QUARANTINED":1795}}
