{"activation_policy":"EXPLICIT_HUMAN_ONLY","bundle_id":"public-reviewed-2026.09","default_model_visibility":true,"export_schema_version":"proto-agent.public-materials-export.v1","files":{"LICENSES.md":"5aaef2e878878423e156ccb6c73dc0207be7d53bb5fa50a567c6fd5045e86472","blobs/01/016abb252860c3952220cc3698048f23bc7983664b322b933a62df0b328e0301.txt.gz":"0ab8739db6b90b62e331a375e64509a022ad6e1bd665795c4172cb9c1fe7a0bd","blobs/30/30685375c37557d018a5d9615952cfe14e2a1d77750da24af2b68f9b3a7db6fa.txt.gz":"34e3a9454a3b049fc1df9f0ff2aee89cb6f2bc5d8636d23c1b136efd1e80f2c4","blobs/44/44f2688342a00e4b01e82be5e655b26499f981515d5da9a6076315627355b403.txt.gz":"f665454c02d9bffa511f9a188fc76eced8b20f2f55de848a8fb8781ad8efc2a7","blobs/48/48ca6b2261599f393698a17e3c76a31d2194c6033be9bba4ef70c4cd6973c715.txt.gz":"3c2bda95211ffb8983512ea900c778c1aae2195379a538f74fbef35a372a9a59","blobs/49/497c824d85114b3acbe93021466cf1999459f8271aaf6f53e9085a854b3b0b2b.txt.gz":"4d8e5b411074645e4198ad89f0451fba2621e7654a7697abefbb011400a51afe","blobs/4c/4c52af42138152d53da16234236e34a9bf7e8a14d1180be852edb47684e84d10.txt.gz":"789a1b927844dca7b8ff9e410c51aa9467663f7a7dd3f06634565cee673ee3a0","blobs/59/5903c6ddd6dd9abe6a29271d7e8e292f8df5b7bd3ca28b9f7b1aa7ee117b2a6a.txt.gz":"aaf51f14a7d10043604d09bee47e638d734dc556f43118cb39cf96f4d5772c16","blobs/69/696c73e5a7a8819fe92177a8866f62fb5549c71284bf8f930854f26fae51318a.txt.gz":"cd2ff31b2fe7a789b291d2d47cce885c40b68debcd20904beaf62c565dca3382","blobs/6d/6de05b2c8ad5084018adf2cce4447ed8946d74a895446dd2a4ab8ff614c1ed49.txt.gz":"e037bbd49f1afcb08448b2f2001845ea7a021da2b6724375f44446f5787bc052","blobs/71/716bac8a7e5d9308884633edab58206b7c780f9e8a76be5470e86105b76c53ba.txt.gz":"8ba566e2be729bb947703e5cffeadbb3076d5d5f95b3cf094e9dcbbb3590d865","blobs/74/7480912e8220d0d9cf8135103da53e5deecb26686b7793cef00b876e0ac5db9b.txt.gz":"ae65059db46a50b2a5985aff9790306338918c18f28bf460ae3987e7a030fb8b","blobs/8e/8e38878c49a3d2141666f8f1c8c8f20dfdf037e8210c3fc70e199a66d30c1a38.txt.gz":"be165473de46277077d5e2dcb4df3c8c1eabacf51511a89c2fb34529c59769db","blobs/ab/abb524dec6b09fa43675e39c5bfe7d0543f9b27c4983fae0bc0c6645f7b43338.txt.gz":"ae79afaf29d2df9c6f608221b2bb4761f227c6db312e0044fc7c9acbe5656378","blobs/b9/b95f3c79165567c1bb4a5262e4c83503f313ac6a1970a57b4812e1f86d43644b.txt.gz":"4069148c2e992c41b9e2d73ca7b9cc12422b954619efdc8ff2425278e8d349fd","blobs/c1/c13f21d5d2147d1098e0915248ade426568ac037a2299f58faedbcb1fd156b55.txt.gz":"e37bc8eb94eb888075d0c9bed13fef5ada968b1e6e218429cbdd13c769825d21","blobs/c2/c278491c9e9b9966c4c2f642a035ad9b3294c97fac236232e50903574a11d1f2.txt.gz":"44841bcc9cc0e16111ecf28d37921db8c09a39eeb69c2c5e551e5bbdc6da6eb9","blobs/d6/d65530952b23612a7f7d3f66692f138f5316ad7efdd42695b8e30b084d246cd9.txt.gz":"f1ebb3d26cd599092ed7e7d5e8b24aeb8820462d59c2b4a7d2e5acfbce577572","blobs/dd/dda8e5ee6ec46b51ea87d0938382b143c453c3464a95d3da9f2cb10199186cee.txt.gz":"e1e521772a54e83efd94ea87bb6b4253871d3f8e212a4618ed09fa59102895b5","catalog.sqlite":"c6af745bc40ff6b44f3b4ee02536e54c8cd2132b2bbac107c8a36c5a22a8f6d9","licenses/catalog.json":"37162cfeb43f05ed2aaf3297877e008965b3adf5e7156e56b2875020d200aaac","manifest.json":"439682c8ececdac7664105f50ed5753a5ea224e3957c42e19264309c47a8016c","provenance.json":"f61442b7af1be760d64b2bece55fa844854c2c6770cba5a69283c5e25bf8327d","quarantine.sqlite":"9e6bf19735e11c6c2d12834736fb7b0ddad95bf39406288c6b623900e4370b82","records.jsonl":"412102766638049459883223822f3ae76b1e0c4fad70cbefe55dc97742bc7108"},"license_counts":{"CC-BY-4.0":17,"CC0-1.0":1},"profile":"PUBLIC_CATALOG","record_count":18,"schema_version":"proto-agent.materials-bundle.v1","source_counts":{"UniProtKB/Swiss-Prot":3,"iGEM Registry":15},"status_counts":{"DESIGN_ELIGIBLE":18}}
